Headline,Description,Link,Time Uploaded
Trump considers 10% tariff on China from next month on first full day of presidency,"It follows threats by Trump to levy import taxes of 25% on Mexico and Canada, accusing them of allowing undocumented migrants and drugs into the US.",/,4 hrs ago
Trump pardons give Jan 6 defendants nearly everything they wanted,Some of the president's own team had signalled not all of those arrested over the Capitol riot would be released - until his order on Monday.,/,2 hrs ago
Trump considers 10% tariff on China from February,The new president accused Beijing of sending fentanyl to Mexico and Canada which ends up in the US.,/sport,5 hrs ago
Six Trump executive orders to watch,"Even presidential powers have their limits - and in some cases, Trump faces hurdles before his plans can become reality.",/video,17 hrs ago
US trades Taliban prisoner for two American detainees,Two Americans held by the Taliban were exchanged for an Afghan imprisoned in the US on narco-terrorism charges.,/news/articles/cjw4vjvlgxpo,4 hrs ago
Trump pardons give Jan 6 defendants nearly everything they wanted,Some of the president's own team had signalled not all of those arrested over the Capitol riot would be released - until his order on Monday.,/news/articles/clyn3z4580do,5 hrs ago
'A long fight full of tears': Why Thailand became a haven for LGBT couples,Thailand is set to legalise same-sex marriage - one of the few places in Asia to do so. Why is it an outlier?,/news/articles/cqld6wnv1rgo,4 hrs ago
"Antisemitic crimes may be funded overseas, say Australian police",The country's federal police says it will increase efforts to deal with surging anti-Jewish crimes.,/news/articles/cvgl8zl7014o,2 hrs ago
Trump pardons Silk Road dark web market creator Ross Ulbricht,Trump said he had called Ulbricht's mother to let her know he had granted her son a full pardon.,/news/articles/cjw4vjvlgxpo,2 hrs ago
Trump considers 10% tariff on China from February,The new president accused Beijing of sending fentanyl to Mexico and Canada which ends up in the US.,/news/articles/cly92g14edro,8 hrs ago
Dozens killed as fire engulfs Turkish ski hotel,The new US President wants to rename the Gulf of Mexico to the Gulf of America. How would that work?,/news/articles/c8057j0mz5mo,7 hrs ago
Nine Palestinians killed as Israeli forces launch major operation in Jenin,The new president accused Beijing of sending fentanyl to Mexico and Canada which ends up in the US.,/news/articles/cz7e0jve875o,3 hrs ago
Netflix to raise prices as new subscribers soar,"The billionaire says his critics ""need better dirty tricks"" after a gesture likened to a Nazi salute.",/news/articles/clyn3z4580do,17 hrs ago
South Korea president denies ordering arrest of lawmakers,Right Rev. Mariann Edgar Budde made a plea to the president in a sermon that Trump later criticised.,/news/articles/c4g375x0zpwo,10 hrs ago
Ukraine's chief army psychiatrist arrested on $1m corruption charge,"Eighteen states have sued the federal government over the executive order, showing the legal challenges the president will face.",/news/articles/ckg750yzdr8o,8 hrs ago
BBC Verify: Can Donald Trump really rename the Gulf of Mexico?,"Forty eight men detained since they fled China years ago risk being deported, rights groups say.",/news/articles/c62693x4qr2o,2 hrs ago
"Tariffs on imports only way to get fairness, says Trump",The BBC hears about horrific violence five women experienced in Libya after fleeing war-torn Sudan.,/news/articles/c1wed43183eo,5 hrs ago
Musk responds to backlash over gesture at Trump rally,"The family of Donnie MacRae, who died aged 33 in a prisoner-of-war camp hospital, want his remains reunited with his body.",/news/articles/cd7dvl0gn1lo,8 hrs ago
Bishop asks Trump to show mercy to LGBT people and migrants,War appears to have accelerated the spread of pathogens resistant to antibiotics in the country.,/news/videos/c1lvm0j5vd8o,9 hrs ago
Trump has vowed to end birthright citizenship. Can he do it?,"The Lose Control singer talks about masculine role models, becoming a father, and facing prejudice.",/news/articles/clyn3z4580do,1 day ago
'Hell on earth': China deportation looms for Uyghurs held in Thailand,The BBC hears about horrific violence five women experienced in Libya after fleeing war-torn Sudan.,/news/articles/cy48v1x4dv4o,4 hrs ago
'A living hell': Sudanese women face rape and abuse in Libya,"Tulip Siddiq has resigned as anti-corruption minister, but questions remain for the Prime Minister.",/news/videos/cn4mwe3lk9wo,21 hrs ago
The World War Two soldier buried without his brain,BBC Verify's Nick Eardley examines Hamas' footage of the moment three hostages were handed over.,/news/articles/c7vdnlmgyndo,3 hrs ago
Dangerous drug-resistant bacteria are spreading in Ukraine,"The family of Donnie MacRae, who died aged 33 in a prisoner-of-war camp hospital, want his remains reunited with his body.",/news/articles/c5ye63grvyko,4 hrs ago
Teddy Swims: 'Every day I try to cry a little bit',"Mohamed Salah's 50th European goal for Liverpool in their Champions League win over Lille showed his ""elite mindset"".",/news/articles/cp3w16k0n7wo,4 hrs ago
'A living hell': Sudanese women face rape and abuse in Libya,Aston Villa boss Unai Emery says his side may have squandered their chances of finishing in the top eight of the Champions League following their loss at Monaco.,/news/articles/c2kxl45kev0o,1 day ago
Her aunt's regime 'disappeared' people in Bangladesh - so why did Starmer make her a minister?,Barcelona twice fight back from two goals down - and two Wojciech Szczesny howlers - to snatch a dramatic victory at Benfica.,/news/articles/c20k5wrgz13o,15 hrs ago
BBC Verify analyses Hamas hostage handover video,Captain Maro Itoje says England can shrug off their poor recent form and deliver a surprise Six Nations Grand Slam.,/news/articles/cn4zzlllen1o,21 hrs ago
The World War Two soldier buried without his brain,"Erling Haaland says he is ""confident"" Manchester City know what they are doing over the charges they face after signing a new long-term deal.",/news/articles/cp3w16k0n7wo,4 hrs ago
Bishop asks Trump to show mercy to LGBT people and migrants,Aston Villa boss Unai Emery says his side may have squandered their chances of finishing in the top eight of the Champions League following their loss at Monaco.,/news/articles/cgmy88e7jdlo,5 hrs ago
BBC Verify: Can Donald Trump really rename the Gulf of Mexico?,"Novak Djokovic says hugging coach Andy Murray after beating Carlos Alcaraz in the Australian Open last eight was a ""gesture of appreciation"".",/news/videos/c5y2gzl091go,11 hrs ago
Trump 'not confident' Israel-Gaza ceasefire will hold,A 17-year-old boy from St Albans is arrested on suspicion of sending online abuse to Arsenal striker Kai Havertz and his wife.,/news/articles/c2kxl45kev0o,7 hrs ago
Barron Trump: Then and now,Barcelona twice fight back from two goals down - and two Wojciech Szczesny howlers - to snatch a dramatic victory at Benfica.,/news/videos/cn4mwe3lk9wo,5 hrs ago
Iconic Bourbon Street in New Orleans covered in rare snow,Authorities closed nine beaches on 14 January after the marble-sized balls washed up.,/news/videos/c1lvm0j5vd8o,11 hrs ago
Trump pardons Silk Road dark web market creator Ross Ulbricht,"Lt Gen Herzi Halevi says ""the terrible failure"" to prevent the Hamas attack ""accompanies me every day"".",/news/videos/ce9n25j375jo,9 hrs ago
Musk responds to backlash over gesture at Trump rally,The country's federal police says it will increase efforts to deal with surging anti-Jewish crimes.,/news/videos/c62egdkvm63o,21 hrs ago
Netflix to raise prices as new subscribers soar,"Prince Harry's barrister said there was potentially a ""good prospect"" of an agreement that would save the court time.",/news/videos/ckgynw09d24o,6 hrs ago
'A long fight full of tears': Why Thailand became a haven for LGBT couples,Haas restructure their race operations team with a series of changes that include appointing Laura Muller as the first female race engineer in Formula 1.,/news/articles/cz7e0jve875o,4 hrs ago
Trump pardons give Jan 6 defendants nearly everything they wanted,"Lt Gen Herzi Halevi says ""the terrible failure"" to prevent the Hamas attack ""accompanies me every day"".",/news/articles/cy48v1x4dv4o,10 hrs ago
Six Trump executive orders to watch,"The attacker, believed to be a Moroccan citizen with US residency, was shot dead at the scene.",/news/articles/c62693x4qr2o,19 hrs ago
Trump considers 10% tariff on China from February,The country's federal police says it will increase efforts to deal with surging anti-Jewish crimes.,/news/articles/cly92g14edro,6 hrs ago
